{"$schema":"https://json-schema.org/draft/2020-12/schema","$id":"https://heyresearch.xyz/schemas/agent-research-receipt.v1.json","title":"AgentResearchReceipt v1","description":"A neutral, project-agnostic record of one autonomous agent's research: the conclusion it reached, from which evidence, as of when. Carries no reasoning trace and no instruction to anyone else. researchState and outcome are the agent's own vocabulary; HEY defines the shape only and never endorses a conclusion.","type":"object","additionalProperties":false,"required":["type","version","agentId","subjectType","subject","createdAt","evidenceCutoff","thesisSummary","claims","risks","unknowns","researchState","reviewConditions","sourceSystems"],"allOf":[{"if":{"properties":{"subjectType":{"const":"project"}}},"then":{"properties":{"subject":{"required":["projectSlug"]}}}},{"if":{"properties":{"subjectType":{"const":"token"}}},"then":{"properties":{"subject":{"required":["tokenContract"]}}}},{"if":{"properties":{"subjectType":{"const":"contract"}}},"then":{"properties":{"subject":{"required":["contract"]}}}}],"properties":{"$schema":{"type":"string","pattern":"^https:\\/\\/[^\\s]{1,490}$","description":"An https:// URL."},"type":{"const":"AgentResearchReceipt"},"version":{"const":"1.0"},"agentId":{"type":"string","minLength":1,"maxLength":200,"description":"The agent's own identifier. Not verified by HEY."},"operator":{"type":"string","minLength":1,"maxLength":200},"mandate":{"type":"string","minLength":1,"maxLength":500},"subjectType":{"enum":["project","token","contract"]},"subject":{"type":"object","additionalProperties":false,"required":["chainId"],"properties":{"chainId":{"type":"integer","minimum":1},"projectSlug":{"type":"string","pattern":"^[a-z0-9][a-z0-9-]{0,79}$"},"tokenContract":{"type":"string","pattern":"^0x[0-9a-fA-F]{40}$"},"contract":{"type":"string","pattern":"^0x[0-9a-fA-F]{40}$"}},"anyOf":[{"required":["projectSlug"]},{"required":["tokenContract"]},{"required":["contract"]}]},"createdAt":{"type":"string","pattern":"^\\d{4}-\\d{2}-\\d{2}T\\d{2}:\\d{2}(:\\d{2}(\\.\\d{1,9})?)?(Z|[+-]\\d{2}:\\d{2})$","description":"ISO 8601 date-time with a zone."},"evidenceCutoff":{"type":"string","pattern":"^\\d{4}-\\d{2}-\\d{2}T\\d{2}:\\d{2}(:\\d{2}(\\.\\d{1,9})?)?(Z|[+-]\\d{2}:\\d{2})$","description":"The newest evidence considered; must not be later than createdAt."},"thesisSummary":{"type":"string","minLength":1,"maxLength":600,"description":"The concise rationale. Not a reasoning trace."},"claims":{"type":"array","minItems":1,"maxItems":50,"items":{"type":"object","additionalProperties":false,"required":["statement","kind"],"properties":{"statement":{"type":"string","minLength":1,"maxLength":500},"kind":{"enum":["FACT","DERIVED","JUDGEMENT"]},"evidence":{"type":"array","maxItems":20,"items":{"oneOf":[{"type":"object","additionalProperties":false,"required":["kind","id"],"properties":{"kind":{"const":"hey_evidence"},"id":{"type":"string","minLength":1,"maxLength":240},"note":{"type":"string","minLength":1,"maxLength":200}},"description":"A HEY typed evidence id, resolvable at /api/evidence/{id}."},{"type":"object","additionalProperties":false,"required":["kind","id"],"properties":{"kind":{"const":"hey_change_event"},"id":{"type":"string","minLength":1,"maxLength":240},"revision":{"type":"integer","minimum":1},"note":{"type":"string","minLength":1,"maxLength":200}},"description":"A ChangeEvent id from /api/changes. The validator compares revision with the one that stands (exists, or revised with current_revision:<n>); without it the answer says revision_not_verified."},{"type":"object","additionalProperties":false,"required":["kind","project","asOf"],"properties":{"kind":{"const":"hey_snapshot"},"project":{"type":"string","pattern":"^[a-z0-9][a-z0-9-]{0,79}$"},"asOf":{"type":"string","pattern":"^\\d{4}-\\d{2}-\\d{2}T\\d{2}:\\d{2}(:\\d{2}(\\.\\d{1,9})?)?(Z|[+-]\\d{2}:\\d{2})$","description":"ISO 8601 date-time with a zone."},"scoringVersion":{"type":"string","minLength":1,"maxLength":40},"note":{"type":"string","minLength":1,"maxLength":200}},"description":"A project snapshot as read. The validator answers project_exists with as_of_not_verified — HEY does not rebuild the snapshot at asOf — and compares scoringVersion with the current one (matches_current, differs_from_current, not_given)."},{"type":"object","additionalProperties":false,"required":["kind","source","observedAt"],"properties":{"kind":{"const":"market_observation"},"source":{"type":"string","minLength":1,"maxLength":80},"observedAt":{"type":"string","pattern":"^\\d{4}-\\d{2}-\\d{2}T\\d{2}:\\d{2}(:\\d{2}(\\.\\d{1,9})?)?(Z|[+-]\\d{2}:\\d{2})$","description":"ISO 8601 date-time with a zone."},"field":{"enum":["marketCap","fdv","price","liquidity","volume24h","other"]},"url":{"type":"string","pattern":"^https:\\/\\/[^\\s]{1,490}$","description":"An https:// URL."},"note":{"type":"string","minLength":1,"maxLength":200}},"description":"A market reading with its provider and observation time."},{"type":"object","additionalProperties":false,"required":["kind","url"],"properties":{"kind":{"const":"external"},"url":{"type":"string","pattern":"^https:\\/\\/[^\\s]{1,490}$","description":"An https:// URL."},"retrievedAt":{"type":"string","pattern":"^\\d{4}-\\d{2}-\\d{2}T\\d{2}:\\d{2}(:\\d{2}(\\.\\d{1,9})?)?(Z|[+-]\\d{2}:\\d{2})$","description":"ISO 8601 date-time with a zone."},"note":{"type":"string","minLength":1,"maxLength":200}},"description":"A public URL and when it was read. HEY never fetches it."},{"type":"object","additionalProperties":false,"required":["kind","capability","schemaVersion","url","asOf"],"properties":{"kind":{"const":"hey_agent_answer"},"capability":{"enum":["research_project","what_changed","builder_status","verify_project","compare_builders","unknowns"]},"schemaVersion":{"const":"1"},"url":{"type":"string","pattern":"^https:\\/\\/[^\\s]{1,490}$","description":"An https:// URL."},"asOf":{"type":"string","pattern":"^\\d{4}-\\d{2}-\\d{2}T\\d{2}:\\d{2}(:\\d{2}(\\.\\d{1,9})?)?(Z|[+-]\\d{2}:\\d{2})$","description":"ISO 8601 date-time with a zone."},"project":{"type":"string","pattern":"^[a-z0-9][a-z0-9-]{0,79}$"},"scoringVersion":{"type":"string","minLength":1,"maxLength":40},"note":{"type":"string","minLength":1,"maxLength":200}},"description":"One answer of HEY's agent contract (AgentIntelligenceResponse v1) as read: the response's own citation object. HEY stores no answers; the validator checks the capability, that the URL is that capability on HEY, and the project."}]}}},"if":{"properties":{"kind":{"enum":["FACT","DERIVED"]}}},"then":{"required":["evidence"],"properties":{"evidence":{"minItems":1}}}}},"risks":{"type":"array","maxItems":50,"items":{"type":"object","additionalProperties":false,"required":["statement"],"properties":{"statement":{"type":"string","minLength":1,"maxLength":500},"evidence":{"type":"array","maxItems":20,"items":{"oneOf":[{"type":"object","additionalProperties":false,"required":["kind","id"],"properties":{"kind":{"const":"hey_evidence"},"id":{"type":"string","minLength":1,"maxLength":240},"note":{"type":"string","minLength":1,"maxLength":200}},"description":"A HEY typed evidence id, resolvable at /api/evidence/{id}."},{"type":"object","additionalProperties":false,"required":["kind","id"],"properties":{"kind":{"const":"hey_change_event"},"id":{"type":"string","minLength":1,"maxLength":240},"revision":{"type":"integer","minimum":1},"note":{"type":"string","minLength":1,"maxLength":200}},"description":"A ChangeEvent id from /api/changes. The validator compares revision with the one that stands (exists, or revised with current_revision:<n>); without it the answer says revision_not_verified."},{"type":"object","additionalProperties":false,"required":["kind","project","asOf"],"properties":{"kind":{"const":"hey_snapshot"},"project":{"type":"string","pattern":"^[a-z0-9][a-z0-9-]{0,79}$"},"asOf":{"type":"string","pattern":"^\\d{4}-\\d{2}-\\d{2}T\\d{2}:\\d{2}(:\\d{2}(\\.\\d{1,9})?)?(Z|[+-]\\d{2}:\\d{2})$","description":"ISO 8601 date-time with a zone."},"scoringVersion":{"type":"string","minLength":1,"maxLength":40},"note":{"type":"string","minLength":1,"maxLength":200}},"description":"A project snapshot as read. The validator answers project_exists with as_of_not_verified — HEY does not rebuild the snapshot at asOf — and compares scoringVersion with the current one (matches_current, differs_from_current, not_given)."},{"type":"object","additionalProperties":false,"required":["kind","source","observedAt"],"properties":{"kind":{"const":"market_observation"},"source":{"type":"string","minLength":1,"maxLength":80},"observedAt":{"type":"string","pattern":"^\\d{4}-\\d{2}-\\d{2}T\\d{2}:\\d{2}(:\\d{2}(\\.\\d{1,9})?)?(Z|[+-]\\d{2}:\\d{2})$","description":"ISO 8601 date-time with a zone."},"field":{"enum":["marketCap","fdv","price","liquidity","volume24h","other"]},"url":{"type":"string","pattern":"^https:\\/\\/[^\\s]{1,490}$","description":"An https:// URL."},"note":{"type":"string","minLength":1,"maxLength":200}},"description":"A market reading with its provider and observation time."},{"type":"object","additionalProperties":false,"required":["kind","url"],"properties":{"kind":{"const":"external"},"url":{"type":"string","pattern":"^https:\\/\\/[^\\s]{1,490}$","description":"An https:// URL."},"retrievedAt":{"type":"string","pattern":"^\\d{4}-\\d{2}-\\d{2}T\\d{2}:\\d{2}(:\\d{2}(\\.\\d{1,9})?)?(Z|[+-]\\d{2}:\\d{2})$","description":"ISO 8601 date-time with a zone."},"note":{"type":"string","minLength":1,"maxLength":200}},"description":"A public URL and when it was read. HEY never fetches it."},{"type":"object","additionalProperties":false,"required":["kind","capability","schemaVersion","url","asOf"],"properties":{"kind":{"const":"hey_agent_answer"},"capability":{"enum":["research_project","what_changed","builder_status","verify_project","compare_builders","unknowns"]},"schemaVersion":{"const":"1"},"url":{"type":"string","pattern":"^https:\\/\\/[^\\s]{1,490}$","description":"An https:// URL."},"asOf":{"type":"string","pattern":"^\\d{4}-\\d{2}-\\d{2}T\\d{2}:\\d{2}(:\\d{2}(\\.\\d{1,9})?)?(Z|[+-]\\d{2}:\\d{2})$","description":"ISO 8601 date-time with a zone."},"project":{"type":"string","pattern":"^[a-z0-9][a-z0-9-]{0,79}$"},"scoringVersion":{"type":"string","minLength":1,"maxLength":40},"note":{"type":"string","minLength":1,"maxLength":200}},"description":"One answer of HEY's agent contract (AgentIntelligenceResponse v1) as read: the response's own citation object. HEY stores no answers; the validator checks the capability, that the URL is that capability on HEY, and the project."}]}}}}},"unknowns":{"type":"array","maxItems":50,"items":{"type":"object","additionalProperties":false,"required":["statement"],"properties":{"statement":{"type":"string","minLength":1,"maxLength":500},"coverageDimension":{"type":"string","minLength":1,"maxLength":60},"category":{"enum":["UNKNOWN","NOT_MEASURED","NOT_VERIFIED","STALE","INSUFFICIENT_EVIDENCE"],"description":"HEY's own unknown category, when the unknown restates one of HEY's."}}}},"researchState":{"type":"object","additionalProperties":false,"required":["value","definition"],"properties":{"value":{"type":"string","minLength":1,"maxLength":40},"definition":{"type":"string","minLength":1,"maxLength":300},"vocabulary":{"type":"string","minLength":1,"maxLength":200}},"description":"The agent's own research state and what it means."},"outcome":{"type":"object","additionalProperties":false,"required":["value","decidedBy"],"properties":{"value":{"type":"string","minLength":1,"maxLength":40},"decidedBy":{"const":"agent"},"definition":{"type":"string","minLength":1,"maxLength":300}},"description":"What the agent decided under its own mandate. Never HEY's."},"confidence":{"type":["number","null"],"minimum":0,"maximum":1},"reviewConditions":{"type":"array","maxItems":20,"items":{"type":"object","additionalProperties":false,"required":["condition"],"properties":{"condition":{"type":"string","minLength":1,"maxLength":300},"watch":{"type":"string","minLength":1,"maxLength":300}}}},"sourceSystems":{"type":"array","minItems":1,"maxItems":10,"items":{"type":"object","additionalProperties":false,"required":["name"],"properties":{"name":{"type":"string","minLength":1,"maxLength":80},"url":{"type":"string","pattern":"^https:\\/\\/[^\\s]{1,490}$","description":"An https:// URL."},"apiVersion":{"type":"string","minLength":1,"maxLength":40}}}},"signature":{"type":"object","additionalProperties":false,"required":["alg","value"],"properties":{"alg":{"type":"string","minLength":1,"maxLength":20},"value":{"type":"string","minLength":1,"maxLength":4096},"kid":{"type":"string","minLength":1,"maxLength":200},"jku":{"type":"string","pattern":"^https:\\/\\/[^\\s]{1,490}$","description":"An https:// URL."}},"description":"Optional; HEY does not verify it."}}}