{
  "type": "AgentResearchReceipt",
  "version": "1.0",
  "agentId": "https://agent.example.org/research-bot",
  "operator": "Example Research Collective",
  "mandate": "Monitor Robinhood Chain infrastructure projects for continued development; no allocation authority.",
  "subjectType": "project",
  "subject": {
    "chainId": 4663,
    "projectSlug": "hoodlock"
  },
  "createdAt": "2026-09-28T12:00:00Z",
  "evidenceCutoff": "2026-09-28T11:45:00Z",
  "thesisSummary": "The project shipped twice in the last 30 days and its lock contract is verified; its token market reading is older than HEY's freshness limit, so market context is set aside.",
  "claims": [
    {
      "statement": "A release was published on 2026-09-21.",
      "kind": "FACT",
      "evidence": [
        {
          "kind": "hey_evidence",
          "id": "ship:3f1c2b1e-4d5a-4c6b-8e7f-9a0b1c2d3e4f"
        }
      ]
    },
    {
      "statement": "HEY lists the activity status as SHIPPING under its published rule.",
      "kind": "DERIVED",
      "evidence": [
        {
          "kind": "hey_snapshot",
          "project": "hoodlock",
          "asOf": "2026-09-28T11:40:00Z",
          "scoringVersion": "hbm-v16"
        }
      ]
    },
    {
      "statement": "Development cadence looks steady to this agent.",
      "kind": "JUDGEMENT",
      "evidence": []
    }
  ],
  "risks": [
    {
      "statement": "The market reading is stale; liquidity today is not known from this evidence.",
      "evidence": [
        {
          "kind": "market_observation",
          "source": "geckoterminal",
          "observedAt": "2026-09-26T08:00:00Z",
          "field": "liquidity"
        }
      ]
    }
  ],
  "unknowns": [
    {
      "statement": "HEY holds no package registry source for this project.",
      "coverageDimension": "package"
    }
  ],
  "researchState": {
    "value": "MONITOR",
    "definition": "Evidence of continued development; revisit on the next release or a coverage change.",
    "vocabulary": "https://agent.example.org/vocabulary/v1"
  },
  "outcome": {
    "value": "MONITOR",
    "decidedBy": "agent",
    "definition": "Keep watching; no action under this mandate."
  },
  "confidence": 0.6,
  "reviewConditions": [
    {
      "condition": "A new release or a status change for the project.",
      "watch": "GET /api/changes?project=hoodlock&after=<cursor>"
    }
  ],
  "sourceSystems": [
    {
      "name": "HEY Research Lab",
      "url": "https://heyresearch.xyz",
      "apiVersion": "1"
    }
  ]
}
